{
  "schemaVersion": "1.0.0",
  "skillId": "SP-10",
  "name": "经营报告与版本草拟",
  "version": "1.1.0-p20",
  "owner": "客户经营Owner",
  "status": "VALIDATION",
  "implementationType": "RULE_MODEL",
  "inputs": ["ContextPackage", "reportType", "audience"],
  "outputs": ["ReportDraft", "citationIndex", "unknowns", "limitations"],
  "assetDependencies": ["ASSET-KNOW-VISIT-SOP"],
  "semanticDependencies": [],
  "ruleDependencies": ["CITATION_REQUIRED", "NO_UNDISCLOSED_DEGRADATION"],
  "humanGatePolicy": "REQUIRED",
  "sideEffectPolicy": "PROPOSE_ONLY"
}
